{
  "$schema": "../../schema/contract.schema.json",
  "domain": "csosn",
  "title": { "en": "CSOSN", "pt-BR": "CSOSN" },
  "summary": {
    "en": "Código de Situação da Operação no Simples Nacional: the tax situation codes of Simples Nacional operations.",
    "pt-BR": "Código de Situação da Operação no Simples Nacional: os códigos das operações de empresas do Simples Nacional."
  },
  "category": "tax",
  "order": 5,
  "related": ["cst"],
  "functions": {
    "isValid": {
      "summary": { "en": "Checks whether a CSOSN code is valid.", "pt-BR": "Verifica se um código CSOSN é válido." },
      "description": {
        "en": [
          "Checks whether a CSOSN is one of the 10 codes of the official table: `101`, `102`, `103`, `201`, `202`, `203`, `300`, `400`, `500`, `900`.",
          "",
          "- Accepts the bare 3 digits as a string, or a non-negative integer. A CSOSN has no printed grouping, so the function rejects a masked value.",
          "- Surrounding whitespace is ignored. Any other string is rejected: the function does not pick out its digits (`\"abc101\"`).",
          "- Nothing is padded: no code starts with a zero, so a value narrower than 3 digits is not a code. A number is read only when it is a safe non-negative integer.",
          "- No behaviour change in 2.5.0.",
          "- Source: Anexo III-A of Convênio SINIEF s/nº 1970 (table instituted by Ajuste SINIEF 03/2010)."
        ],
        "pt-BR": [
          "Verifica se um CSOSN é um dos 10 códigos da tabela oficial: `101`, `102`, `103`, `201`, `202`, `203`, `300`, `400`, `500`, `900`.",
          "",
          "- Aceita os 3 dígitos sem formatação como string, ou um inteiro não negativo. O CSOSN não tem agrupamento impresso, então a função rejeita um valor com máscara.",
          "- Espaços nas extremidades são ignorados. Qualquer outra string é rejeitada: a função não extrai os dígitos dela (`\"abc101\"`).",
          "- Nada é completado com zeros: nenhum código começa com zero, então um valor com menos de 3 dígitos não é um código. Um número só é lido se for um inteiro seguro não negativo.",
          "- Sem mudança de comportamento na 2.5.0.",
          "- Fonte: Anexo III-A do Convênio SINIEF s/nº 1970 (tabela instituída pelo Ajuste SINIEF 03/2010)."
        ]
      },
      "references": [
        "https://www.confaz.fazenda.gov.br/legislacao/ajustes/sinief/cvsn_70",
        "https://www.confaz.fazenda.gov.br/legislacao/ajustes/2010/aj_003_10"
      ],
      "params": [{ "name": "value", "type": "string | number" }],
      "returns": "boolean",
      "tests": [
        { "args": ["101"], "returns": true },
        { "args": ["102"], "returns": true },
        { "name": "nonexistent", "args": ["999"], "returns": false },
        { "name": "too-short", "args": ["10"], "returns": false },
        { "name": "separator", "args": ["1-01"], "returns": false },
        { "name": "letters", "args": ["abc"], "returns": false },
        { "name": "empty", "args": [""], "returns": false },
        { "args": [101], "returns": true, "note": "JavaScript's own test: should return true for a number input" },
        { "args": [" 101 "], "returns": true, "note": "JavaScript's own test: should return true with surrounding whitespace" },
        { "args": ["1010"], "returns": false, "note": "JavaScript's own test: should return false for a length different from 3" },
        { "args": ["abc101"], "returns": false, "note": "JavaScript's own test: should return false for a string that is not a documented form" },
        { "args": ["1--01"], "returns": false, "note": "JavaScript's own test: should return false for a string that is not a documented form" },
        { "args": ["1 01"], "returns": false, "note": "JavaScript's own test: should return false for a code split by a separator, since a CSOSN has no printed grouping" },
        { "args": ["10.1"], "returns": false, "note": "JavaScript's own test: should return false for a code split by a separator, since a CSOSN has no printed grouping" },
        { "args": ["1-0-1"], "returns": false, "note": "JavaScript's own test: should return false for a code split by a separator, since a CSOSN has no printed grouping" },
        { "args": [-101], "returns": false, "note": "JavaScript's own test: should return false for a number that is not a non-negative safe integer" },
        { "args": [10.1], "returns": false, "note": "JavaScript's own test: should return false for a number that is not a non-negative safe integer" },
        { "args": ["103"], "returns": true, "note": "JavaScript's own test: should return true for every known CSOSN code" },
        { "args": ["201"], "returns": true, "note": "JavaScript's own test: should return true for every known CSOSN code" },
        { "args": ["202"], "returns": true, "note": "JavaScript's own test: should return true for every known CSOSN code" },
        { "args": ["203"], "returns": true, "note": "JavaScript's own test: should return true for every known CSOSN code" },
        { "args": ["300"], "returns": true, "note": "JavaScript's own test: should return true for every known CSOSN code" },
        { "args": ["400"], "returns": true, "note": "JavaScript's own test: should return true for every known CSOSN code" },
        { "args": ["500"], "returns": true, "note": "JavaScript's own test: should return true for every known CSOSN code" },
        { "args": ["900"], "returns": true, "note": "JavaScript's own test: should return true for every known CSOSN code" },
        { "args": [900], "returns": true, "note": "JavaScript docs example" }
      ]
    }
  }
}
